{
	"simSettings": {
		"mode": "normal",
		"playbackSpeed": 1,
		"secondsPerUpdate": 12,
		"startTimeMins": 0,
		"numHistories": 3
	},
	"viewSettings": {
		"vRange": 100,
		"statsDecimalPlaces": 0,
		"proximityDecimalPlaces": 1
	},
	"atmosphere": {
		"wind": { "from": 360, "speed": 0 },
		"seaLevelTemp": 15,
		"seaLevelPressure": 29.92
	},
	"aircraftList": [
		{
			"callsign": "N737KG",
			"position": { "x": 0, "y": 10 },
			"track": 180,
			"alt": 200,
			"tas": 300,
			"display": {}
		},
		{
			"position": { "r": 100, "d": 5 },
			"directFix": { "x": 0, "y": 0 },
			"alt": 200,
			"mach": 0.79,
			"display": {
				"halo": true,
				"datablockSlot": 8
			}
		}
	],
	"stats": [{ "flid": "N737KG" }],
	"proximities": [{ "flid1": "N737KG", "index2": 2 }]
}
